{
  "id": "base60.digits",
  "type": "digits",
  "version": "0.1.0",
  "description": "Complete specification of all 60 digits (0-59)",
  "content": {
    "digit_definitions": [
      {"value": 0, "tens": 0, "units": 0, "glyphs": {"wedge_ascii": "∅", "wedge_unicode_modern": "∅"}},
      {"value": 1, "tens": 0, "units": 1, "glyphs": {"wedge_ascii": "|", "wedge_unicode_modern": "𒁹"}},
      {"value": 2, "tens": 0, "units": 2, "glyphs": {"wedge_ascii": "||", "wedge_unicode_modern": "𒁹𒁹"}},
      {"value": 3, "tens": 0, "units": 3, "glyphs": {"wedge_ascii": "|||", "wedge_unicode_modern": "𒁹𒁹𒁹"}},
      {"value": 4, "tens": 0, "units": 4, "glyphs": {"wedge_ascii": "||||", "wedge_unicode_modern": "𒁹𒁹𒁹𒁹"}},
      {"value": 5, "tens": 0, "units": 5, "glyphs": {"wedge_ascii": "|||||", "wedge_unicode_modern": "𒁹𒁹𒁹𒁹𒁹"}},
      {"value": 6, "tens": 0, "units": 6, "glyphs": {"wedge_ascii": "||||||", "wedge_unicode_modern": "𒁹𒁹𒁹𒁹𒁹𒁹"}},
      {"value": 7, "tens": 0, "units": 7, "glyphs": {"wedge_ascii": "|||||||", "wedge_unicode_modern": "𒁹𒁹𒁹𒁹𒁹𒁹𒁹"}},
      {"value": 8, "tens": 0, "units": 8, "glyphs": {"wedge_ascii": "||||||||", "wedge_unicode_modern": "𒁹𒁹𒁹𒁹𒁹𒁹𒁹𒁹"}},
      {"value": 9, "tens": 0, "units": 9, "glyphs": {"wedge_ascii": "|||||||||", "wedge_unicode_modern": "𒁹𒁹𒁹𒁹𒁹𒁹𒁹𒁹𒁹"}},
      {"value": 10, "tens": 1, "units": 0, "glyphs": {"wedge_ascii": "<", "wedge_unicode_modern": "𒌋"}},
      {"value": 11, "tens": 1, "units": 1, "glyphs": {"wedge_ascii": "<|", "wedge_unicode_modern": "𒌋𒁹"}},
      {"value": 12, "tens": 1, "units": 2, "glyphs": {"wedge_ascii": "<||", "wedge_unicode_modern": "𒌋𒁹𒁹"}},
      {"value": 13, "tens": 1, "units": 3, "glyphs": {"wedge_ascii": "<|||", "wedge_unicode_modern": "𒌋𒁹𒁹𒁹"}},
      {"value": 14, "tens": 1, "units": 4, "glyphs": {"wedge_ascii": "<||||", "wedge_unicode_modern": "𒌋𒁹𒁹𒁹𒁹"}},
      {"value": 15, "tens": 1, "units": 5, "glyphs": {"wedge_ascii": "<|||||", "wedge_unicode_modern": "𒌋𒁹𒁹𒁹𒁹𒁹"}},
      {"value": 16, "tens": 1, "units": 6, "glyphs": {"wedge_ascii": "<||||||", "wedge_unicode_modern": "𒌋𒁹𒁹𒁹𒁹𒁹𒁹"}},
      {"value": 17, "tens": 1, "units": 7, "glyphs": {"wedge_ascii": "<|||||||", "wedge_unicode_modern": "𒌋𒁹𒁹𒁹𒁹𒁹𒁹𒁹"}},
      {"value": 18, "tens": 1, "units": 8, "glyphs": {"wedge_ascii": "<||||||||", "wedge_unicode_modern": "𒌋𒁹𒁹𒁹𒁹𒁹𒁹𒁹𒁹"}},
      {"value": 19, "tens": 1, "units": 9, "glyphs": {"wedge_ascii": "<|||||||||", "wedge_unicode_modern": "𒌋𒁹𒁹𒁹𒁹𒁹𒁹𒁹𒁹𒁹"}},
      {"value": 20, "tens": 2, "units": 0, "glyphs": {"wedge_ascii": "<<", "wedge_unicode_modern": "𒌋𒌋"}},
      {"value": 21, "tens": 2, "units": 1, "glyphs": {"wedge_ascii": "<<|", "wedge_unicode_modern": "𒌋𒌋𒁹"}},
      {"value": 22, "tens": 2, "units": 2, "glyphs": {"wedge_ascii": "<<||", "wedge_unicode_modern": "𒌋𒌋𒁹𒁹"}},
      {"value": 23, "tens": 2, "units": 3, "glyphs": {"wedge_ascii": "<<|||", "wedge_unicode_modern": "𒌋𒌋𒁹𒁹𒁹"}},
      {"value": 24, "tens": 2, "units": 4, "glyphs": {"wedge_ascii": "<<||||", "wedge_unicode_modern": "𒌋𒌋𒁹𒁹𒁹𒁹"}},
      {"value": 25, "tens": 2, "units": 5, "glyphs": {"wedge_ascii": "<<|||||", "wedge_unicode_modern": "𒌋𒌋𒁹𒁹𒁹𒁹𒁹"}},
      {"value": 26, "tens": 2, "units": 6, "glyphs": {"wedge_ascii": "<<||||||", "wedge_unicode_modern": "𒌋𒌋𒁹𒁹𒁹𒁹𒁹𒁹"}},
      {"value": 27, "tens": 2, "units": 7, "glyphs": {"wedge_ascii": "<<|||||||", "wedge_unicode_modern": "𒌋𒌋𒁹𒁹𒁹𒁹𒁹𒁹𒁹"}},
      {"value": 28, "tens": 2, "units": 8, "glyphs": {"wedge_ascii": "<<||||||||", "wedge_unicode_modern": "𒌋𒌋𒁹𒁹𒁹𒁹𒁹𒁹𒁹𒁹"}},
      {"value": 29, "tens": 2, "units": 9, "glyphs": {"wedge_ascii": "<<|||||||||", "wedge_unicode_modern": "𒌋𒌋𒁹𒁹𒁹𒁹𒁹𒁹𒁹𒁹𒁹"}},
      {"value": 30, "tens": 3, "units": 0, "glyphs": {"wedge_ascii": "<<<", "wedge_unicode_modern": "𒌋𒌋𒌋"}},
      {"value": 31, "tens": 3, "units": 1, "glyphs": {"wedge_ascii": "<<<|", "wedge_unicode_modern": "𒌋𒌋𒌋𒁹"}},
      {"value": 32, "tens": 3, "units": 2, "glyphs": {"wedge_ascii": "<<<||", "wedge_unicode_modern": "𒌋𒌋𒌋𒁹𒁹"}},
      {"value": 33, "tens": 3, "units": 3, "glyphs": {"wedge_ascii": "<<<|||", "wedge_unicode_modern": "𒌋𒌋𒌋𒁹𒁹𒁹"}},
      {"value": 34, "tens": 3, "units": 4, "glyphs": {"wedge_ascii": "<<<||||", "wedge_unicode_modern": "𒌋𒌋𒌋𒁹𒁹𒁹𒁹"}},
      {"value": 35, "tens": 3, "units": 5, "glyphs": {"wedge_ascii": "<<<|||||", "wedge_unicode_modern": "𒌋𒌋𒌋𒁹𒁹𒁹𒁹𒁹"}},
      {"value": 36, "tens": 3, "units": 6, "glyphs": {"wedge_ascii": "<<<||||||", "wedge_unicode_modern": "𒌋𒌋𒌋𒁹𒁹𒁹𒁹𒁹𒁹"}},
      {"value": 37, "tens": 3, "units": 7, "glyphs": {"wedge_ascii": "<<<|||||||", "wedge_unicode_modern": "𒌋𒌋𒌋𒁹𒁹𒁹𒁹𒁹𒁹𒁹"}},
      {"value": 38, "tens": 3, "units": 8, "glyphs": {"wedge_ascii": "<<<||||||||", "wedge_unicode_modern": "𒌋𒌋𒌋𒁹𒁹𒁹𒁹𒁹𒁹𒁹𒁹"}},
      {"value": 39, "tens": 3, "units": 9, "glyphs": {"wedge_ascii": "<<<|||||||||", "wedge_unicode_modern": "𒌋𒌋𒌋𒁹𒁹𒁹𒁹𒁹𒁹𒁹𒁹𒁹"}},
      {"value": 40, "tens": 4, "units": 0, "glyphs": {"wedge_ascii": "<<<<", "wedge_unicode_modern": "𒌋𒌋𒌋𒌋"}},
      {"value": 41, "tens": 4, "units": 1, "glyphs": {"wedge_ascii": "<<<<|", "wedge_unicode_modern": "𒌋𒌋𒌋𒌋𒁹"}},
      {"value": 42, "tens": 4, "units": 2, "glyphs": {"wedge_ascii": "<<<<||", "wedge_unicode_modern": "𒌋𒌋𒌋𒌋𒁹𒁹"}},
      {"value": 43, "tens": 4, "units": 3, "glyphs": {"wedge_ascii": "<<<<|||", "wedge_unicode_modern": "𒌋𒌋𒌋𒌋𒁹𒁹𒁹"}},
      {"value": 44, "tens": 4, "units": 4, "glyphs": {"wedge_ascii": "<<<<||||", "wedge_unicode_modern": "𒌋𒌋𒌋𒌋𒁹𒁹𒁹𒁹"}},
      {"value": 45, "tens": 4, "units": 5, "glyphs": {"wedge_ascii": "<<<<|||||", "wedge_unicode_modern": "𒌋𒌋𒌋𒌋𒁹𒁹𒁹𒁹𒁹"}},
      {"value": 46, "tens": 4, "units": 6, "glyphs": {"wedge_ascii": "<<<<||||||", "wedge_unicode_modern": "𒌋𒌋𒌋𒌋𒁹𒁹𒁹𒁹𒁹𒁹"}},
      {"value": 47, "tens": 4, "units": 7, "glyphs": {"wedge_ascii": "<<<<|||||||", "wedge_unicode_modern": "𒌋𒌋𒌋𒌋𒁹𒁹𒁹𒁹𒁹𒁹𒁹"}},
      {"value": 48, "tens": 4, "units": 8, "glyphs": {"wedge_ascii": "<<<<||||||||", "wedge_unicode_modern": "𒌋𒌋𒌋𒌋𒁹𒁹𒁹𒁹𒁹𒁹𒁹𒁹"}},
      {"value": 49, "tens": 4, "units": 9, "glyphs": {"wedge_ascii": "<<<<|||||||||", "wedge_unicode_modern": "𒌋𒌋𒌋𒌋𒁹𒁹𒁹𒁹𒁹𒁹𒁹𒁹𒁹"}},
      {"value": 50, "tens": 5, "units": 0, "glyphs": {"wedge_ascii": "<<<<<", "wedge_unicode_modern": "𒌋𒌋𒌋𒌋𒌋"}},
      {"value": 51, "tens": 5, "units": 1, "glyphs": {"wedge_ascii": "<<<<<|", "wedge_unicode_modern": "𒌋𒌋𒌋𒌋𒌋𒁹"}},
      {"value": 52, "tens": 5, "units": 2, "glyphs": {"wedge_ascii": "<<<<<||", "wedge_unicode_modern": "𒌋𒌋𒌋𒌋𒌋𒁹𒁹"}},
      {"value": 53, "tens": 5, "units": 3, "glyphs": {"wedge_ascii": "<<<<<|||", "wedge_unicode_modern": "𒌋𒌋𒌋𒌋𒌋𒁹𒁹𒁹"}},
      {"value": 54, "tens": 5, "units": 4, "glyphs": {"wedge_ascii": "<<<<<||||", "wedge_unicode_modern": "𒌋𒌋𒌋𒌋𒌋𒁹𒁹𒁹𒁹"}},
      {"value": 55, "tens": 5, "units": 5, "glyphs": {"wedge_ascii": "<<<<<|||||", "wedge_unicode_modern": "𒌋𒌋𒌋𒌋𒌋𒁹𒁹𒁹𒁹𒁹"}},
      {"value": 56, "tens": 5, "units": 6, "glyphs": {"wedge_ascii": "<<<<<||||||", "wedge_unicode_modern": "𒌋𒌋𒌋𒌋𒌋𒁹𒁹𒁹𒁹𒁹𒁹"}},
      {"value": 57, "tens": 5, "units": 7, "glyphs": {"wedge_ascii": "<<<<<|||||||", "wedge_unicode_modern": "𒌋𒌋𒌋𒌋𒌋𒁹𒁹𒁹𒁹𒁹𒁹𒁹"}},
      {"value": 58, "tens": 5, "units": 8, "glyphs": {"wedge_ascii": "<<<<<||||||||", "wedge_unicode_modern": "𒌋𒌋𒌋𒌋𒌋𒁹𒁹𒁹𒁹𒁹𒁹𒁹𒁹"}},
      {"value": 59, "tens": 5, "units": 9, "glyphs": {"wedge_ascii": "<<<<<|||||||||", "wedge_unicode_modern": "𒌋𒌋𒌋𒌋𒌋𒁹𒁹𒁹𒁹𒁹𒁹𒁹𒁹𒁹"}}
    ]
  },
  "metadata": {
    "created": "2025-12-31T00:00:00Z",
    "author": "ENKI System"
  },
  "dependencies": ["base60.glyphs"]
}

